{
  "id": "economics.presentation.tables.diagnostics",
  "domain": "economics",
  "description": "Deterministic diagnostics table rendering from the `diagnostics` scientific artifact using explicit `diagnostic_id` selection. Derived view only; must NOT define or recompute scientific estimands/statistics; full artifact-bundle provenance validation required. Supported fields: diagnostic_id / name / value / method / model_id. Not yet fully journal-publication-ready — this is a deterministic, canonical diagnostics reference rendering layer.",
  "risk_level": "medium",
  "methodology": {
    "references": [
      {
        "name": "World Bank / DIME — niger-asp-reprod (observed report_tables)",
        "url": "https://github.com/dime-worldbank/niger-asp-reprod"
      },
      {
        "name": "Adopting the Euro — SCM replication (observed 4_ComparisonTables -> Output)",
        "url": "https://github.com/RicardoGabriel/Euro-SCM-Replication-EJPE"
      },
      {
        "name": "Awesome-Journal-Skills (workflow/template precedent: 00_master.do 09_tables.do)",
        "url": "https://github.com/brycewang-stanford/Awesome-Journal-Skills"
      },
      {
        "name": "AEA journals data & code (institutional presentation-style guidance)",
        "url": "https://www.aeaweb.org/journals/policies/data-code"
      }
    ],
    "note": "Engineering abstraction: deterministic diagnostics table rendering from the diagnostics artifact (explicit diagnostic_id) with fixed fields diagnostic_id/name/value/method/model_id. Upstream template precedent: journal-skills 09_tables.do; observed table stage: niger-asp report_tables / euro-scm 4_ComparisonTables. Institutional guidance: src-aea-style (presentation only). Scope is narrow: diagnostics-source, explicit diagnostic_id; does NOT claim model tables or general descriptive tables and is NOT described as fully journal-publication-ready."
  },
  "implementations": [
    {
      "id": "presentation.local.diagnostics_table_renderer",
      "kind": "script",
      "name": "domains/economics/presentation/render_family_table.mjs",
      "runtime": "node",
      "verification_status": "tested",
      "environment_requirements": {
        "runtime": "node"
      },
      "verification": {
        "evidence": "Accepted evidence (scope: deterministic diagnostics table rendering from diagnostics with explicit diagnostic_id, fixed fields diagnostic_id/name/value/method/model_id, full artifact/provenance validation): (1) synthetic family presentation benchmark (regression/adversarial invariant evidence: determinism, source fidelity, provenance/tamper enforcement, explicit scope); (2) Grunfeld real-data presentation benchmark family views (non-synthetic source identity, complete artifact/provenance validation, source fidelity, deterministic rendering, provenance enforcement). Status = tested for this diagnostics scope only. NOT generic tables, NOT model or descriptive tables, NOT figures, NOT journal-publication-ready output, NOT verified scientific methodology.",
        "benchmark_ref": "domains/economics/benchmarks/presentation/"
      }
    }
  ],
  "scientific_preconditions": [],
  "decision_requirements": [],
  "fallback_policy": "hard_stop"
}
