{
  "id": "economics.stat.testing.multcomp",
  "domain": "economics",
  "description": "Multiple-testing correction for a family of hypotheses",
  "risk_level": "medium",
  "methodology": {
    "references": [
      {
        "name": "Holm 1979 / Benjamini-Hochberg",
        "url": "https://..."
      }
    ],
    "note": "family-wide error control"
  },
  "implementations": [
    {
      "id": "multcomp.python.statsmodels",
      "kind": "tool",
      "name": "statsmodels multipletests",
      "runtime": "python",
      "verification_status": "experimental",
      "environment_requirements": {
        "runtime": "python",
        "packages": {
          "statsmodels": ">=0.14"
        }
      },
      "verification": {
        "evidence": null,
        "benchmark_ref": null
      }
    },
    {
      "id": "multcomp.r.base",
      "kind": "tool",
      "name": "p.adjust",
      "runtime": "r",
      "verification_status": "reference",
      "environment_requirements": {
        "runtime": "r"
      },
      "verification": {
        "evidence": null,
        "benchmark_ref": null
      }
    }
  ],
  "scientific_preconditions": [],
  "decision_requirements": [
    "family_definition",
    "correction_method"
  ],
  "fallback_policy": "needs_decision"
}
