{
  "id": "economics.presentation.tables.estimates",
  "domain": "economics",
  "description": "Deterministic estimate-table rendering from the `estimates` scientific artifact using explicit `estimate_id` selection. Derived view only; must NOT define or recompute scientific estimands/statistics; full artifact-bundle provenance validation required. Fixed scientific fields currently supported by the renderer: term / estimate / std_error / p_value / n. Not yet fully journal-publication-ready — this is a deterministic, canonical estimate-table reference rendering layer.",
  "risk_level": "medium",
  "methodology": {
    "references": [
      { "name": "Awesome-Journal-Skills (workflow/template precedent: 00_master.do 09_tables.do)", "url": "https://github.com/brycewang-stanford/Awesome-Journal-Skills" },
      { "name": "AEA journals data & code (institutional presentation-style guidance)", "url": "https://www.aeaweb.org/journals/policies/data-code" }
    ],
    "note": "Engineering abstraction: deterministic estimate-table rendering from the estimates artifact (explicit estimate_id) with fixed scientific fields term/estimate/std_error/p_value/n. Upstream template precedent: journal-skills 09_tables.do. Institutional guidance: src-aea-style. Scope is narrow: estimates-source, explicit estimate_id; does NOT claim general descriptive/diagnostic/model tables and is NOT described as fully journal-publication-ready."
  },
  "implementations": [
    {
      "id": "presentation.local.table_renderer",
      "kind": "script",
      "name": "domains/economics/presentation/render_table.mjs",
      "runtime": "node",
      "verification_status": "experimental",
      "environment_requirements": { "runtime": "node" },
      "verification": {
        "evidence": "Deterministic estimate-table renderer benchmark (domains/economics/benchmarks/presentation/): determinism + source-fidelity + upstream-change + tamper-detection. Described as a deterministic/canonical estimate-table reference rendering layer; experimental only, NOT journal-publication-ready, NOT yet passed the tested gate.",
        "benchmark_ref": "domains/economics/benchmarks/presentation/"
      }
    }
  ],
  "scientific_preconditions": [],
  "decision_requirements": [],
  "fallback_policy": "hard_stop"
}
