{
  "id": "economics.presentation.tables",
  "domain": "economics",
  "description": "Deterministic publication-ready table presentation over multiple scientific artifact types (model_registry / estimates / diagnostics / descriptive_facts). Derived view only; must NOT define or recompute scientific estimands/statistics; must preserve provenance back to the source artifact. Reference-only for now — no local generic table renderer attached.",
  "risk_level": "medium",
  "methodology": {
    "references": [
      {
        "name": "World Bank / DIME — niger-asp-reprod (observed report_tables)",
        "url": "https://github.com/dime-worldbank/niger-asp-reprod"
      },
      {
        "name": "Adopting the Euro — SCM replication (observed 4_ComparisonTables -> Output)",
        "url": "https://github.com/RicardoGabriel/Euro-SCM-Replication-EJPE"
      },
      {
        "name": "World Bank EduAnalytics — Learning Poverty (observed 03_export_tables)",
        "url": "https://github.com/worldbank/LearningPoverty"
      },
      {
        "name": "Awesome-Journal-Skills (workflow/template precedent: 00_master.do 09_tables.do)",
        "url": "https://github.com/brycewang-stanford/Awesome-Journal-Skills"
      },
      {
        "name": "AEA journals data & code (institutional presentation-style guidance)",
        "url": "https://www.aeaweb.org/journals/policies/data-code"
      }
    ],
    "note": "Observed practice: real projects render tables as a deterministic step (niger-asp report_tables; euro-scm 4_ComparisonTables; learning-poverty 03_export_tables). Workflow/template precedent: journal-skills 09_tables.do. Institutional: src-aea-style (presentation only). Engineering abstraction: artifact-only deterministic table rendering — values from upstream machine-readable artifacts, tables are derived views, no new numerical source of truth, provenance preserved."
  },
  "implementations": [
    {
      "id": "presentation.ref.journal_skills_stage",
      "kind": "workflow",
      "name": "journal-skills table stage (upstream template reference)",
      "runtime": "any",
      "verification_status": "reference",
      "environment_requirements": {
        "runtime": "any"
      },
      "verification": {
        "evidence": null,
        "benchmark_ref": null
      }
    }
  ],
  "scientific_preconditions": [],
  "decision_requirements": [],
  "fallback_policy": "hard_stop"
}
