{
  "id": "economics.presentation.tables_figures",
  "domain": "economics",
  "description": "Deterministic rendering of publication-ready tables and figures from already-produced machine-readable scientific artifacts (model_registry / estimates / diagnostics / data_manifest). It must NOT define or recompute scientific estimands; tables/figures are derived views and must preserve provenance back to the source artifact. Formatting choices must not change scientific conclusions.",
  "risk_level": "medium",
  "methodology": {
    "references": [
      {
        "name": "World Bank / DIME — niger-asp-reprod (observed report_tables / report_graphs / report_stats)",
        "url": "https://github.com/dime-worldbank/niger-asp-reprod"
      },
      {
        "name": "Adopting the Euro — SCM replication (observed ComparisonTables / Graphs -> Output)",
        "url": "https://github.com/RicardoGabriel/Euro-SCM-Replication-EJPE"
      },
      {
        "name": "World Bank EduAnalytics — Learning Poverty (observed 03_export_tables / 05_working_paper)",
        "url": "https://github.com/worldbank/LearningPoverty"
      },
      {
        "name": "Awesome-Journal-Skills (workflow/template precedent: 00_master.do 09_tables.do + tables-figures skill)",
        "url": "https://github.com/brycewang-stanford/Awesome-Journal-Skills"
      },
      {
        "name": "AEA journals data & code (institutional presentation-style guidance)",
        "url": "https://www.aeaweb.org/journals/policies/data-code"
      }
    ],
    "note": "Observed practice: real projects render tables/figures as a deterministic step (niger-asp report_tables/graphs; euro-scm 4_ComparisonTables / 5_Graphs -> Output; learning-poverty 03_export_tables / 05_working_paper). Workflow/template precedent: journal-skills 09_tables.do + aejmac-tables-figures. Institutional guidance: src-aea-style (presentation only). Our engineering abstraction: artifact-only deterministic rendering — scientific numbers must come from upstream machine-readable artifacts, tables/figures are derived views, presentation must not add a new numerical source of truth, and rendering must preserve provenance back to the source artifact."
  },
  "implementations": [
    {
      "id": "presentation.ref.journal_skills_stage",
      "kind": "workflow",
      "name": "journal-skills tables/figures stage",
      "runtime": "any",
      "verification_status": "reference",
      "environment_requirements": {
        "runtime": "any"
      },
      "verification": {
        "evidence": null,
        "benchmark_ref": null
      }
    }
  ],
  "scientific_preconditions": [],
  "decision_requirements": [],
  "fallback_policy": "hard_stop"
}
