{
  "id": "economics.presentation.tables.models",
  "domain": "economics",
  "description": "Deterministic model/specification registry table rendering from the `model_registry` scientific artifact using explicit `model_id` selection. Derived view only; must NOT define or recompute scientific estimands/statistics; full artifact-bundle provenance validation required. Supported fields: model_id / capability_id / implementation_id / runtime / sample_id / outcome / specification / fixed_effects / vcov_spec / clustering / n. Not yet fully journal-publication-ready — this is a deterministic, canonical model-registry reference rendering layer.",
  "risk_level": "medium",
  "methodology": {
    "references": [
      {
        "name": "World Bank / DIME — niger-asp-reprod (observed report_tables)",
        "url": "https://github.com/dime-worldbank/niger-asp-reprod"
      },
      {
        "name": "Adopting the Euro — SCM replication (observed 4_ComparisonTables -> Output)",
        "url": "https://github.com/RicardoGabriel/Euro-SCM-Replication-EJPE"
      },
      {
        "name": "World Bank EduAnalytics — Learning Poverty (observed 03_export_tables)",
        "url": "https://github.com/worldbank/LearningPoverty"
      },
      {
        "name": "Awesome-Journal-Skills (workflow/template precedent: 00_master.do 09_tables.do)",
        "url": "https://github.com/brycewang-stanford/Awesome-Journal-Skills"
      },
      {
        "name": "AEA journals data & code (institutional presentation-style guidance)",
        "url": "https://www.aeaweb.org/journals/policies/data-code"
      }
    ],
    "note": "Engineering abstraction: deterministic model/specification registry table rendering from the model_registry artifact (explicit model_id) with fixed fields model_id/capability_id/implementation_id/runtime/sample_id/outcome/specification/fixed_effects/vcov_spec/clustering/n. Upstream template precedent: journal-skills 09_tables.do; observed table stage: niger-asp report_tables / euro-scm 4_ComparisonTables / learning-poverty 03_export_tables. Institutional guidance: src-aea-style (presentation only). Scope is narrow: model_registry-source, explicit model_id; does NOT claim estimates or diagnostics tables and is NOT described as fully journal-publication-ready."
  },
  "implementations": [
    {
      "id": "presentation.local.model_table_renderer",
      "kind": "script",
      "name": "domains/economics/presentation/render_family_table.mjs",
      "runtime": "node",
      "verification_status": "tested",
      "environment_requirements": {
        "runtime": "node"
      },
      "verification": {
        "evidence": "Accepted evidence (scope: deterministic model-registry table rendering from model_registry with explicit model_id, fixed fields model_id/capability_id/implementation_id/runtime/sample_id/outcome/specification/fixed_effects/vcov_spec/clustering/n, full artifact/provenance validation): (1) synthetic family presentation benchmark (regression/adversarial invariant evidence: determinism, source fidelity, provenance/tamper enforcement, explicit scope); (2) Grunfeld real-data presentation benchmark family views (non-synthetic source identity, complete artifact/provenance validation, source fidelity, deterministic rendering, provenance enforcement). Status = tested for this model_registry scope only. NOT generic tables, NOT estimates or diagnostics tables, NOT figures, NOT journal-publication-ready output, NOT verified scientific methodology.",
        "benchmark_ref": "domains/economics/benchmarks/presentation/"
      }
    }
  ],
  "scientific_preconditions": [],
  "decision_requirements": [],
  "fallback_policy": "hard_stop"
}
