{
  "id": "economics.presentation.figures",
  "domain": "economics",
  "description": "Deterministic figure rendering from already-produced machine-readable scientific artifacts (model_registry / estimates / diagnostics / descriptive_facts). Derived view only; must NOT define or recompute scientific estimands/statistics; must preserve provenance back to the source artifact; formatting must not change scientific conclusions. Reference-only for now — no local figure renderer is implemented yet.",
  "risk_level": "medium",
  "methodology": {
    "references": [
      { "name": "World Bank / DIME — niger-asp-reprod (observed report_graphs)", "url": "https://github.com/dime-worldbank/niger-asp-reprod" },
      { "name": "Adopting the Euro — SCM replication (observed 5_Graphs -> Output)", "url": "https://github.com/RicardoGabriel/Euro-SCM-Replication-EJPE" },
      { "name": "World Bank EduAnalytics — Learning Poverty (observed 05_working_paper figures)", "url": "https://github.com/worldbank/LearningPoverty" },
      { "name": "Awesome-Journal-Skills (workflow/template precedent: aejmac-tables-figures skill)", "url": "https://github.com/brycewang-stanford/Awesome-Journal-Skills" },
      { "name": "AEA journals data & code (institutional presentation-style guidance)", "url": "https://www.aeaweb.org/journals/policies/data-code" }
    ],
    "note": "Observed practice: real projects render figures as a deterministic step (niger-asp report_graphs; euro-scm 5_Graphs; learning-poverty 05_working_paper). Workflow/template precedent: journal-skills tables-figures skill. Institutional: src-aea-style (presentation only). Engineering abstraction: artifact-only deterministic figure rendering — derived views, no new numerical source of truth, provenance preserved. No local figure renderer implemented; reference-only."
  },
  "implementations": [
    {
      "id": "presentation.ref.journal_skills_figures",
      "kind": "workflow",
      "name": "journal-skills tables-figures stage (upstream template reference)",
      "runtime": "any",
      "verification_status": "reference",
      "environment_requirements": { "runtime": "any" },
      "verification": { "evidence": null, "benchmark_ref": null }
    }
  ],
  "scientific_preconditions": [],
  "decision_requirements": [],
  "fallback_policy": "hard_stop"
}
